year,district,DBN,school_name,enrollment,avg_grade_8_english_proficiency,avg_grade_8_math_proficiency,%_ELL,%_disability,%_self_contained,economic_need_index,%_temp_housing,%_HRA_eligible,%_asian,%_black,%_hispanic,%_white,student_attendance_rate,%_chronically_absent
2018,29,29Q272,George Washington Carver High School for the Scien,468,2.77,2.42,0.066,0.156,0.015,0.669,0.092,0.585,0.053,0.746,0.158,0.006,0.872,0.369
2018,29,29Q283,Preparatory Academy for Writers: A College Board S,406,2.95,2.63,0.015,0.163,0.002,0.536,0.052,0.461,0.025,0.921,0.039,0.002,0.860,0.369
2018,29,29Q313,Benjamin Franklin High School for Finance & Inform,397,2.68,2.38,0.118,0.164,0.038,0.688,0.123,0.572,0.154,0.625,0.149,0.025,0.862,0.440
2018,29,29Q326,Cambria Heights Academy,353,2.67,2.32,0.059,0.181,0.003,0.572,0.091,0.493,0.102,0.771,0.085,0.011,0.883,0.299
2018,29,29Q327,Eagle Academy for Young Men III,298,2.61,2.27,0.003,0.262,0.060,0.499,0.060,0.409,0.013,0.862,0.037,0.027,0.872,0.409
2018,29,29Q492,"Mathematics, Science Research and Technology Magne",415,2.72,2.49,0.075,0.106,0.005,0.684,0.106,0.588,0.137,0.663,0.135,0.017,0.837,0.459
2018,29,29Q498,Humanities & Arts Magnet High School,454,2.66,2.30,0.099,0.150,0.004,0.681,0.073,0.581,0.042,0.780,0.137,0.020,0.855,0.454
2018,30,30Q258,Energy Tech High School,511,3.06,3.02,0.029,0.170,0.000,0.611,0.041,0.519,0.174,0.100,0.550,0.133,0.921,0.237
2018,30,30Q286,"Young Women's Leadership School, Astoria",319,3.33,3.11,0.044,0.116,0.006,0.743,0.019,0.649,0.351,0.072,0.389,0.176,0.937,0.167
2018,30,30Q301,Academy for Careers in Television and Film,565,3.17,2.92,0.019,0.204,0.004,0.532,0.032,0.416,0.058,0.120,0.547,0.204,0.929,0.205
2018,30,30Q445,William Cullen Bryant High School,2394,2.87,2.74,0.168,0.140,0.049,0.792,0.080,0.678,0.264,0.069,0.498,0.148,0.874,0.328
2018,30,30Q450,Long Island City High School,2256,2.84,2.63,0.117,0.158,0.008,0.795,0.079,0.711,0.151,0.105,0.659,0.065,0.866,0.385
2018,30,30Q501,Frank Sinatra School of the Arts High School,831,3.65,3.51,0.005,0.159,0.000,0.394,0.018,0.292,0.107,0.148,0.350,0.363,0.928,0.196
2018,30,30Q502,Information Technology High School,1007,2.84,2.77,0.080,0.191,0.051,0.776,0.093,0.687,0.196,0.117,0.590,0.084,0.888,0.329
2018,30,30Q555,Newcomers High School,911,1.94,2.29,0.794,0.008,0.000,0.974,0.251,0.613,0.296,0.010,0.626,0.061,0.893,0.280
2018,30,30Q575,Academy of American Studies,1038,3.51,3.47,0.030,0.082,0.000,0.547,0.018,0.447,0.247,0.051,0.343,0.355,0.934,0.170
2018,30,30Q580,Baccalaureate School for Global Education,358,3.98,4.09,0.017,0.073,0.020,0.434,0.011,0.338,0.439,0.050,0.193,0.285,0.955,0.100
2018,31,31R028,The Eagle Academy for Young Men of Staten Island,40,2.57,2.25,0.050,0.425,0.050,0.736,0.125,0.575,0.100,0.525,0.275,0.100,0.913,0.244
2018,31,31R047,CSI High School for International Studies,495,3.48,3.33,0.002,0.154,0.004,0.358,0.010,0.271,0.143,0.081,0.196,0.560,0.949,0.112
2018,31,31R064,Gaynor McCown Expeditionary Learning School,439,3.14,2.87,0.005,0.253,0.055,0.357,0.014,0.255,0.027,0.077,0.221,0.651,0.905,0.267
2018,31,31R080,The Michael J. Petrides School,457,3.11,2.99,0.007,0.263,0.037,0.455,0.018,0.333,0.079,0.239,0.199,0.396,0.914,0.276
2018,31,31R440,New Dorp High School,3045,3.00,2.75,0.044,0.221,0.066,0.554,0.049,0.464,0.091,0.104,0.280,0.512,0.897,0.210
2018,31,31R445,Port Richmond High School,1549,2.83,2.52,0.079,0.262,0.088,0.715,0.098,0.620,0.072,0.229,0.440,0.241,0.849,0.392
2018,31,31R450,Curtis High School,2587,2.92,2.59,0.080,0.190,0.019,0.741,0.103,0.628,0.064,0.361,0.406,0.149,0.850,0.385
2018,31,31R455,Tottenville High School,3808,3.33,3.23,0.012,0.193,0.044,0.321,0.028,0.242,0.056,0.016,0.119,0.791,0.909,0.258
2018,31,31R460,Susan E. Wagner High School,3284,3.20,2.97,0.027,0.219,0.072,0.522,0.050,0.433,0.144,0.111,0.269,0.464,0.903,0.269
2018,31,31R600,Ralph R. McKee Career and Technical Education High,792,2.71,2.45,0.063,0.301,0.098,0.702,0.058,0.612,0.052,0.268,0.461,0.197,0.863,0.382
2018,31,31R605,Staten Island Technical High School,1320,4.16,4.32,0.000,0.012,0.000,0.360,0.009,0.253,0.484,0.008,0.028,0.448,0.964,0.070
2018,32,32K168,The Brooklyn School for Math and Research,269,2.83,2.76,0.097,0.190,0.011,0.820,0.126,0.729,0.056,0.468,0.405,0.048,0.904,0.290
2018,32,32K403,Academy for Environmental Leadership,272,2.41,2.10,0.375,0.232,0.022,0.903,0.213,0.750,0.037,0.176,0.750,0.037,0.790,0.605
2018,32,32K545,EBC High School for Public Service - Bushwick,498,2.55,2.23,0.211,0.225,0.000,0.919,0.120,0.853,0.008,0.088,0.882,0.018,0.843,0.527
2018,32,32K549,The Brooklyn School for Social Justice,364,2.45,2.14,0.324,0.217,0.000,0.916,0.173,0.813,0.011,0.190,0.755,0.030,0.774,0.657
2018,32,32K552,The Academy of Urban Planning and Engineering,197,2.32,2.22,0.259,0.223,0.005,0.909,0.152,0.802,0.010,0.173,0.787,0.020,0.912,0.267
2018,32,32K554,All City Leadership Secondary School,255,3.51,3.61,0.027,0.125,0.004,0.729,0.035,0.616,0.075,0.102,0.769,0.051,0.929,0.200
2018,32,32K556,Bushwick Leaders High School for Academic Excellen,281,2.45,2.13,0.267,0.270,0.014,0.922,0.217,0.826,0.007,0.171,0.797,0.011,0.823,0.566
2018,84,84K356,Achievement First Crown Heights Charter School,211,3.25,3.46,0.000,0.133,0.005,0.575,0.028,0.427,0.005,0.948,0.047,0.000,0.960,0.061
2018,84,84K357,KIPP AMP Charter School,170,2.97,3.09,0.012,0.153,0.000,0.706,0.112,0.547,0.000,0.888,0.059,0.000,0.924,0.228
2018,84,84K358,Achievement First East New York Charter School,145,3.47,3.54,0.028,0.090,0.014,0.686,0.055,0.531,0.014,0.690,0.276,0.007,0.959,0.074
2018,84,84K359,The Uft Charter School,266,2.61,2.18,0.053,0.083,0.000,0.811,0.139,0.699,0.023,0.737,0.222,0.008,0.851,0.474
2018,84,84K473,Williamsburg Charter High School,947,2.83,2.52,0.060,0.159,0.037,0.794,0.075,0.687,0.004,0.270,0.703,0.016,0.859,0.432
2018,84,84K508,Achievement First Endeavor Charter School,221,3.30,3.67,0.005,0.167,0.000,0.734,0.059,0.615,0.000,0.837,0.163,0.000,0.932,0.146
2018,84,84K517,Leadership Prep Bedford Stuyvesant Uncommon Prep C,325,3.16,3.40,0.018,0.108,0.015,0.724,0.062,0.588,0.003,0.754,0.151,0.012,,
2018,84,84K538,Achievement First Bushwick Charter School,220,3.53,3.92,0.023,0.068,0.000,0.734,0.018,0.609,0.000,0.432,0.568,0.000,0.967,0.027
2018,84,84K608,Kings Collegiate Charter School,116,3.10,3.53,0.000,0.138,0.000,0.832,0.078,0.776,0.000,0.802,0.181,0.000,0.956,0.120
2018,84,84K626,Achievement First Brownsville Charter School,189,3.26,3.35,0.011,0.127,0.011,0.671,0.063,0.519,0.016,0.868,0.090,0.000,0.951,0.106
2018,84,84K652,Brooklyn Ascend Charter School,248,2.87,2.65,0.024,0.161,0.004,0.685,0.040,0.569,0.004,0.887,0.101,0.000,0.956,0.080
2018,84,84K693,Northside Charter High School,410,2.87,2.54,0.066,0.200,0.005,0.767,0.054,0.661,0.015,0.146,0.759,0.061,0.934,0.186
2018,84,84K707,Brooklyn Prospect Charter School,415,3.20,3.17,0.010,0.173,0.002,0.447,0.034,0.325,0.080,0.135,0.398,0.328,,
2018,84,84K712,Excellence Girls Charter School,607,3.19,3.46,0.008,0.125,0.005,0.628,0.038,0.493,0.003,0.713,0.242,0.005,0.884,0.333
2018,84,84K730,Summit Academy Charter School,204,2.83,2.65,0.020,0.162,0.015,0.782,0.088,0.657,0.005,0.559,0.368,0.025,0.852,0.316
2018,84,84K733,"Math, Engineering, and Science Academy Charter Hig",471,2.76,2.55,0.106,0.132,0.004,0.822,0.064,0.732,0.019,0.110,0.794,0.017,0.936,0.192
2018,84,84K738,New Visions Charter High School for Advanced Math,404,2.88,2.68,0.042,0.126,0.002,0.644,0.050,0.532,0.047,0.777,0.101,0.017,0.928,0.214
2018,84,84K739,New Visions Charter High School for the Humanities,324,2.74,2.41,0.019,0.164,0.012,0.697,0.114,0.593,0.003,0.855,0.105,0.012,0.891,0.363
2018,84,84K744,Coney Island Preparatory Public Charter School,332,3.08,3.14,0.021,0.202,0.003,0.748,0.054,0.642,0.096,0.404,0.361,0.117,0.950,0.121
2018,84,84K757,Unity Prep Charter School,197,2.78,2.43,0.041,0.244,0.020,0.769,0.086,0.650,0.000,0.812,0.152,0.010,0.947,0.106
2018,84,84K775,Leadership Preparatory Ocean Hill Charter School,369,3.27,3.62,0.000,0.095,0.000,0.662,0.046,0.528,0.014,0.881,0.057,0.008,0.946,0.141
2018,84,84K803,Brooklyn LABÿCharter School,110,2.86,2.53,0.036,0.282,0.073,0.713,0.109,0.591,0.009,0.773,0.173,0.027,0.874,0.400
2018,84,84K892,Brooklyn Emerging Leaders Academy,64,2.88,2.46,0.031,0.250,0.016,0.752,0.156,0.625,0.000,0.828,0.156,0.016,0.983,0.000
2018,84,84M065,Democracy Prep Endurance Charter School,261,3.26,3.19,0.023,0.157,0.011,0.755,0.111,0.594,0.000,0.655,0.330,0.004,0.928,0.237
2018,84,84M068,KIPP Washington Heights Middle School,174,3.33,3.48,0.057,0.149,0.006,0.824,0.080,0.718,0.000,0.126,0.874,0.000,0.938,0.155
2018,84,84M279,The Opportunity Charter School,226,2.39,1.99,0.097,0.650,0.199,0.879,0.133,0.779,0.013,0.553,0.425,0.004,0.877,0.447
2018,84,84M284,Harlem Children's Zone Promise Academy 1 Charter S,274,2.97,2.94,0.011,0.131,0.004,0.791,0.062,0.675,0.004,0.861,0.095,0.007,0.934,0.164
2018,84,84M335,Harlem Village Academy Leadership Charter School,182,3.03,2.97,0.000,0.209,0.005,0.773,0.071,0.615,0.000,0.676,0.324,0.000,0.919,0.295
2018,84,84M336,KIPP Infinity Charter School,294,3.44,3.80,0.014,0.214,0.007,0.807,0.061,0.690,0.000,0.238,0.752,0.010,0.916,0.264
2018,84,84M341,Harlem Children's Zone Promise Academy II Charter,218,3.21,3.37,0.009,0.110,0.000,0.786,0.078,0.670,0.009,0.862,0.110,0.009,0.927,0.205
2018,84,84M350,Democracy Prep Charter School,373,3.30,3.54,0.038,0.121,0.008,0.762,0.083,0.625,0.011,0.646,0.316,0.011,0.932,0.159
2018,84,84M351,Success Academy Charter School - Harlem 1,343,3.86,4.01,0.000,0.125,0.006,0.675,0.017,0.519,0.003,0.761,0.204,0.012,,
2018,84,84M353,New Heights Academy Charter School,383,2.89,2.54,0.070,0.131,0.000,0.894,0.099,0.820,0.000,0.029,0.971,0.000,0.924,0.201
2018,84,84M382,DREAM Charter School,98,2.76,2.54,0.031,0.224,0.000,0.847,0.143,0.704,0.041,0.235,0.684,0.031,0.950,0.178
2018,84,84M385,Success Academy Charter School - Harlem 3,106,3.82,3.81,0.000,0.142,0.000,0.723,0.047,0.557,0.000,0.792,0.198,0.000,,
2018,84,84M433,Renaissance Charter High School for Innovation,445,2.50,2.21,0.115,0.339,0.052,0.886,0.130,0.789,0.009,0.425,0.555,0.004,0.883,0.364
2018,84,84M478,Inwood Academy for Leadership Charter School,420,2.77,2.75,0.112,0.210,0.010,0.822,0.074,0.700,0.000,0.064,0.924,0.005,0.917,0.268
2018,84,84M481,Democracy Prep Harlem Charter School,302,3.06,3.17,0.040,0.152,0.020,0.759,0.083,0.623,0.003,0.603,0.354,0.010,0.925,0.262
2018,84,84M522,Broome Street Academy Charter School,330,2.72,2.43,0.036,0.242,0.006,0.774,0.176,0.655,0.012,0.555,0.358,0.021,0.759,0.738
2018,84,84M708,Harlem Prep Charter School,194,3.03,2.98,0.036,0.206,0.036,0.806,0.124,0.665,0.005,0.598,0.392,0.005,0.942,0.141
2018,84,84M709,Harlem Village Academy Charter School,185,2.90,3.03,0.016,0.178,0.011,0.711,0.081,0.524,0.000,0.805,0.184,0.005,0.926,0.230
2018,84,84M726,KIPP STAR College Prep Charter School,253,3.11,3.15,0.028,0.257,0.000,0.757,0.028,0.621,0.008,0.490,0.466,0.012,0.933,0.186
2018,84,84Q320,New Visions Charter High School for Advanced Math,373,2.82,2.56,0.040,0.180,0.043,0.541,0.059,0.440,0.083,0.710,0.158,0.013,0.939,0.196
2018,84,84Q373,New Visions Charter High School for the Humanities,86,2.74,2.37,0.023,0.244,0.023,0.728,0.116,0.651,0.058,0.593,0.209,0.047,0.915,0.296
2018,84,84Q705,Renaissance Charter School,212,3.17,3.13,0.028,0.146,0.009,0.568,0.033,0.443,0.179,0.099,0.623,0.094,0.940,0.174
2018,84,84R067,John W. Lavelle Preparatory Charter School,197,2.75,2.61,0.020,0.376,0.000,0.619,0.030,0.497,0.041,0.325,0.477,0.137,0.900,0.391
2018,84,84X185,Bronx Lighthouse Charter School,232,3.01,2.80,0.043,0.138,0.000,0.762,0.039,0.621,0.009,0.315,0.668,0.009,0.927,0.180
2018,84,84X202,New Visions Charter High School for Advanced Math,548,2.80,2.57,0.100,0.166,0.009,0.827,0.093,0.714,0.018,0.431,0.500,0.011,0.913,0.297
2018,84,84X208,New Visions Charter High School for the Humanities,488,2.58,2.31,0.143,0.207,0.031,0.830,0.137,0.711,0.012,0.389,0.574,0.004,0.859,0.440
2018,84,84X345,Hyde Leadership Charter School,268,2.88,2.87,0.041,0.183,0.000,0.815,0.078,0.683,0.000,0.306,0.694,0.000,0.903,0.324
2018,84,84X347,International Leadership Charter High School,349,2.91,2.66,0.097,0.158,0.009,0.807,0.066,0.693,0.014,0.129,0.814,0.011,0.940,0.205
2018,84,84X393,University Prep Charter High School,433,2.92,2.75,0.076,0.139,0.014,0.803,0.088,0.672,0.014,0.344,0.630,0.007,0.983,0.009
2018,84,84X395,"NYC Charter High School for Architecture, Engineer",424,2.65,2.44,0.085,0.217,0.012,0.853,0.101,0.750,0.007,0.413,0.566,0.005,0.932,0.221
2018,84,84X429,Charter High School for Law and Social Justice,350,2.81,2.40,0.111,0.131,0.011,0.834,0.129,0.714,0.003,0.206,0.711,0.000,,
2018,84,84X461,Metropolitan Lighthouse Charter School,49,2.95,2.44,0.102,0.082,0.000,0.843,0.061,0.714,0.000,0.347,0.633,0.020,0.948,0.154
2018,84,84X471,American Dream Charter School,86,2.85,2.74,0.267,0.163,0.012,0.926,0.116,0.779,0.000,0.081,0.895,0.000,0.949,0.078
2018,84,84X482,Dr. Richard Izquierdo Health and Science Charter S,438,2.85,2.65,0.110,0.180,0.007,0.869,0.080,0.744,0.011,0.258,0.710,0.011,0.917,0.296
2018,84,84X488,The Equality Charter School,371,2.87,2.61,0.024,0.218,0.011,0.646,0.054,0.531,0.008,0.623,0.358,0.003,0.936,0.198
2018,84,84X539,New Visions Charter High School for Advanced Math,496,2.81,2.62,0.081,0.133,0.016,0.789,0.113,0.649,0.030,0.415,0.506,0.010,0.893,0.366
2018,84,84X553,New Visions Charter High School for the Humanities,550,2.71,2.42,0.093,0.184,0.035,0.828,0.122,0.715,0.016,0.322,0.640,0.009,0.898,0.345
2018,84,84X581,South Bronx Community Charter School,215,2.87,2.64,0.088,0.181,0.037,0.841,0.051,0.735,0.000,0.349,0.642,0.000,,
2018,84,84X703,Bronx Preparatory Charter School,366,3.02,2.95,0.052,0.087,0.003,0.807,0.044,0.664,0.000,0.451,0.536,0.005,0.949,0.121
2018,84,84X704,KIPP Academy Charter School,273,3.17,3.18,0.048,0.183,0.004,0.791,0.059,0.637,0.004,0.377,0.604,0.000,0.940,0.153
2019,1,01M292,Orchard Collegiate Academy,197,2.70,2.33,0.117,0.289,0.005,0.870,0.183,0.782,0.096,0.269,0.569,0.030,0.917,0.289
2019,1,01M448,University Neighborhood High School,483,2.97,2.99,0.147,0.170,0.000,0.830,0.180,0.723,0.369,0.195,0.383,0.046,0.909,0.274
2019,1,01M450,East Side Community School,370,3.07,3.06,0.016,0.246,0.000,0.680,0.084,0.541,0.130,0.192,0.522,0.124,0.938,0.146
2019,1,01M509,Marta Valle High School,127,2.79,2.36,0.063,0.276,0.047,0.810,0.134,0.740,0.071,0.370,0.512,0.024,0.796,0.628
2019,1,01M539,"New Explorations into Science, Technology and Math",615,3.70,3.90,0.003,0.143,0.002,0.400,0.020,0.285,0.268,0.124,0.187,0.390,0.952,0.096
2019,1,01M696,Bard High School Early College,615,3.88,4.10,0.002,0.076,0.000,0.400,0.026,0.293,0.293,0.111,0.171,0.398,0.948,0.114
2019,2,02M047,47 The American Sign Language and English Secondar,196,2.93,2.69,0.046,0.270,0.010,0.770,0.163,0.673,0.031,0.276,0.643,0.046,0.900,0.352
2019,2,02M135,The Urban Assembly School for Emergency Management,265,2.85,2.49,0.034,0.223,0.004,0.810,0.158,0.702,0.060,0.283,0.600,0.034,0.860,0.465
2019,2,02M139,Stephen T. Mather Building Arts & Craftsmanship Hi,401,2.74,2.59,0.072,0.257,0.000,0.830,0.117,0.721,0.042,0.264,0.631,0.042,0.849,0.527
2019,2,02M260,The Clinton School,433,3.68,3.62,0.005,0.180,0.000,0.250,0.009,0.152,0.111,0.055,0.143,0.628,0.946,0.149
2019,2,02M280,Manhattan Early College School for Advertising,416,2.98,2.80,0.038,0.183,0.000,0.720,0.115,0.603,0.099,0.361,0.450,0.053,0.892,0.327
2019,2,02M282,Urban Assembly Maker Academy,390,2.94,2.81,0.038,0.190,0.003,0.720,0.087,0.608,0.082,0.269,0.497,0.108,0.889,0.329
2019,2,02M288,Food and Finance High School,375,2.81,2.62,0.032,0.197,0.003,0.780,0.104,0.683,0.059,0.360,0.539,0.029,0.880,0.395
2019,2,02M294,Essex Street Academy,339,2.97,2.65,0.035,0.271,0.000,0.690,0.088,0.563,0.062,0.345,0.428,0.106,0.886,0.347
2019,2,02M296,High School of Hospitality Management,380,2.67,2.35,0.092,0.261,0.008,0.870,0.158,0.789,0.050,0.276,0.645,0.018,0.841,0.421
2019,2,02M298,Pace High School,572,2.98,2.80,0.030,0.184,0.000,0.750,0.087,0.631,0.045,0.330,0.540,0.040,0.869,0.445
2019,2,02M300,"Urban Assembly School of Design and Construction,",302,2.65,2.56,0.116,0.258,0.007,0.860,0.172,0.768,0.056,0.225,0.682,0.026,0.813,0.482
2019,2,02M303,"Facing History School, The",372,2.62,2.37,0.110,0.245,0.000,0.860,0.172,0.766,0.011,0.255,0.699,0.022,0.800,0.566
2019,2,02M305,"Urban Assembly Academy of Government and Law, The",324,2.84,2.54,0.040,0.207,0.006,0.850,0.170,0.769,0.059,0.340,0.565,0.031,0.852,0.464
2019,2,02M308,Lower Manhattan Arts Academy,290,2.70,2.34,0.069,0.366,0.021,0.820,0.145,0.693,0.086,0.286,0.583,0.028,0.868,0.438
2019,2,02M316,"Urban Assembly School of Business for Young Women,",179,2.93,2.56,0.073,0.168,0.000,0.840,0.128,0.760,0.056,0.492,0.374,0.034,0.811,0.513
2019,2,02M374,Gramercy Arts High School,468,3.11,2.82,0.021,0.171,0.006,0.760,0.098,0.652,0.045,0.327,0.519,0.064,0.838,0.496
2019,2,02M376,NYC iSchool,466,3.67,3.70,0.011,0.165,0.004,0.340,0.047,0.212,0.084,0.148,0.223,0.487,0.947,0.114
2019,2,02M392,Manhattan Business Academy,414,2.87,2.66,0.063,0.210,0.002,0.810,0.147,0.710,0.063,0.225,0.650,0.046,0.848,0.454
2019,2,02M393,Business Of Sports School,429,2.59,2.37,0.082,0.242,0.002,0.800,0.152,0.688,0.012,0.329,0.611,0.030,0.847,0.513
2019,2,02M399,The High School For Language And Diplomacy,302,2.85,2.79,0.109,0.175,0.010,0.830,0.123,0.725,0.242,0.232,0.464,0.033,0.830,0.472
2019,2,02M400,High School for Environmental Studies,1146,2.98,2.91,0.087,0.189,0.020,0.790,0.111,0.681,0.111,0.161,0.649,0.065,0.861,0.350
2019,2,02M407,Institute for Collaborative Education,277,2.92,2.77,0.007,0.191,0.000,0.390,0.065,0.253,0.061,0.217,0.202,0.487,0.916,0.176
2019,2,02M408,Professional Performing Arts High School,435,3.47,3.42,0.002,0.145,0.000,0.400,0.048,0.239,0.076,0.225,0.209,0.432,0.933,0.183
2019,2,02M411,Baruch College Campus High School,475,3.74,3.91,0.011,0.118,0.002,0.400,0.059,0.312,0.354,0.036,0.137,0.432,0.960,0.082
2019,2,02M412,N.Y.C. Lab School for Collaborative Studies,471,3.74,3.85,0.006,0.206,0.000,0.300,0.025,0.206,0.191,0.036,0.123,0.575,0.938,0.160
2019,2,02M413,School of the Future High School,445,3.37,3.39,0.002,0.196,0.000,0.430,0.067,0.315,0.182,0.110,0.267,0.351,0.945,0.143
2019,2,02M414,N.Y.C. Museum School,449,3.63,3.69,0.009,0.203,0.002,0.560,0.045,0.441,0.245,0.136,0.376,0.223,0.929,0.206
2019,2,02M416,Eleanor Roosevelt High School,530,4.02,4.18,0.000,0.155,0.000,0.200,0.009,0.130,0.158,0.026,0.100,0.675,0.968,0.055
2019,2,02M418,Millennium High School,681,3.80,3.96,0.007,0.125,0.000,0.480,0.056,0.389,0.470,0.038,0.110,0.320,0.970,0.061
2019,2,02M419,Landmark High School,330,2.67,2.35,0.055,0.224,0.000,0.830,0.136,0.721,0.030,0.339,0.591,0.024,0.799,0.607
2019,2,02M420,High School for Health Professions and Human Servi,1825,3.17,3.19,0.042,0.130,0.002,0.750,0.081,0.650,0.220,0.156,0.530,0.079,0.920,0.218
2019,2,02M422,Quest to Learn,378,2.84,2.58,0.037,0.280,0.003,0.650,0.114,0.553,0.119,0.204,0.431,0.209,0.864,0.423
2019,2,02M425,Leadership and Public Service High School,473,2.83,2.61,0.049,0.201,0.000,0.830,0.123,0.746,0.085,0.268,0.590,0.036,0.832,0.501
2019,2,02M427,Manhattan Academy For Arts & Language,233,2.01,2.08,0.674,0.124,0.013,0.960,0.433,0.777,0.009,0.021,0.948,0.021,0.865,0.438
2019,2,02M432,Murray Hill Academy,304,2.65,2.41,0.039,0.250,0.003,0.820,0.151,0.724,0.059,0.306,0.530,0.066,0.804,0.550
2019,2,02M437,Hudson High School of Learning Technologies,476,2.74,2.51,0.088,0.256,0.004,0.830,0.137,0.725,0.061,0.252,0.628,0.034,0.822,0.552
2019,2,02M438,International High School at Union Square,356,1.93,2.16,0.862,0.034,0.000,0.970,0.402,0.716,0.157,0.202,0.534,0.098,0.890,0.332
2019,2,02M439,Manhattan Village Academy,452,3.35,3.32,0.020,0.157,0.000,0.680,0.049,0.527,0.084,0.159,0.666,0.086,0.981,0.022
2019,2,02M449,Vanguard High School,427,2.78,2.50,0.030,0.246,0.005,0.760,0.089,0.651,0.059,0.246,0.593,0.068,0.870,0.423
2019,2,02M459,Manhattan International High School,313,1.98,2.19,0.716,0.022,0.003,0.930,0.233,0.636,0.144,0.150,0.508,0.195,0.877,0.401
2019,2,02M475,Stuyvesant High School,3316,4.20,4.39,0.000,0.005,0.000,0.400,0.020,0.288,0.732,0.009,0.030,0.188,0.968,0.058
2019,2,02M489,High School of Economics and Finance,741,2.90,2.89,0.059,0.193,0.009,0.770,0.109,0.657,0.216,0.250,0.443,0.080,0.898,0.233
2019,2,02M500,Unity Center for Urban Technologies,278,2.73,2.53,0.068,0.237,0.004,0.880,0.180,0.795,0.083,0.259,0.612,0.040,0.804,0.550
2019,2,02M507,Urban Assembly Gateway School for Technology,456,3.01,2.93,0.035,0.224,0.000,0.670,0.092,0.513,0.064,0.309,0.546,0.066,0.922,0.240
2019,2,02M519,Talent Unlimited High School,518,3.29,3.09,0.010,0.141,0.002,0.530,0.052,0.400,0.039,0.305,0.446,0.137,0.909,0.275
2019,2,02M520,Murry Bergtraum High School for Business Careers,182,2.67,2.37,0.060,0.236,0.005,0.810,0.110,0.709,0.044,0.511,0.412,0.016,0.782,0.560
2019,2,02M529,Jacqueline Kennedy Onassis High School,443,2.68,2.42,0.090,0.201,0.023,0.790,0.131,0.695,0.061,0.242,0.652,0.034,0.785,0.640
2019,2,02M531,Repertory Company High School for Theatre Arts,237,3.33,3.13,0.004,0.169,0.000,0.560,0.051,0.418,0.008,0.325,0.460,0.181,0.910,0.311
2019,2,02M533,Union Square Academy for Health Sciences,414,2.82,2.69,0.075,0.152,0.002,0.830,0.104,0.742,0.114,0.205,0.611,0.065,0.878,0.391
2019,2,02M534,Harvest Collegiate High School,457,3.06,2.80,0.024,0.252,0.009,0.640,0.072,0.514,0.066,0.210,0.495,0.188,0.861,0.382
2019,2,02M542,Manhattan Bridges High School,532,2.43,2.67,0.464,0.073,0.006,0.910,0.280,0.776,0.002,0.004,0.989,0.002,0.906,0.294
2019,2,02M543,New Design High School,426,2.66,2.36,0.054,0.263,0.012,0.830,0.129,0.732,0.049,0.345,0.577,0.014,0.827,0.532
2019,2,02M545,High School for Dual Language and Asian Studies,402,3.27,4.00,0.134,0.032,0.000,0.780,0.162,0.677,0.910,0.022,0.035,0.022,0.985,0.015
2019,2,02M546,Academy for Software Engineering,459,3.01,2.97,0.041,0.259,0.002,0.680,0.063,0.549,0.102,0.207,0.566,0.109,0.893,0.291
2019,2,02M551,Urban Assembly New York Harbor School,533,3.04,2.87,0.021,0.229,0.002,0.540,0.068,0.428,0.075,0.173,0.405,0.266,0.891,0.310
2019,2,02M580,Richard R. Green High School of Teaching,429,2.87,2.61,0.042,0.189,0.000,0.780,0.119,0.655,0.063,0.289,0.599,0.033,0.906,0.227
2019,2,02M600,The High School of Fashion Industries,1577,3.05,2.77,0.032,0.162,0.040,0.760,0.107,0.649,0.055,0.313,0.570,0.052,0.901,0.314
2019,2,02M605,Humanities Preparatory Academy,245,3.05,2.79,0.033,0.204,0.000,0.740,0.200,0.567,0.061,0.216,0.620,0.073,0.836,0.421
2019,2,02M615,Chelsea Career and Technical Education High School,451,2.91,2.80,0.040,0.195,0.004,0.790,0.102,0.701,0.135,0.215,0.616,0.027,0.852,0.459
2019,2,02M630,Art and Design High School,1478,3.35,3.15,0.008,0.212,0.013,0.570,0.068,0.444,0.085,0.148,0.539,0.173,0.894,0.295
2019,2,02M655,Life Sciences Secondary School,425,2.69,2.43,0.104,0.219,0.026,0.860,0.160,0.760,0.073,0.256,0.624,0.038,0.775,0.626
2019,3,03M291,West End Secondary School,118,3.50,3.42,0.000,0.195,0.000,0.190,0.034,0.110,0.034,0.085,0.195,0.669,0.956,0.085
2019,3,03M299,The Maxine Greene HS for Imaginative Inquiry,341,2.72,2.42,0.129,0.252,0.029,0.850,0.182,0.757,0.029,0.370,0.531,0.041,0.811,0.571
2019,3,03M307,"Urban Assembly School for Media Studies, The",407,2.79,2.52,0.054,0.155,0.000,0.850,0.133,0.757,0.025,0.322,0.607,0.020,0.849,0.513
2019,3,03M402,The Urban Assembly School for Green Careers,304,2.71,2.44,0.151,0.234,0.007,0.830,0.171,0.734,0.023,0.280,0.589,0.086,0.816,0.558
2019,3,03M403,The Global Learning Collaborative,414,2.76,2.58,0.123,0.203,0.014,0.850,0.143,0.758,0.019,0.256,0.662,0.051,0.857,0.392
2019,3,03M415,Wadleigh Secondary School for the Performing & Vis,227,2.82,2.45,0.022,0.211,0.000,0.870,0.185,0.780,0.004,0.537,0.401,0.018,0.867,0.444
2019,3,03M417,Frank McCourt High School,413,3.25,3.23,0.029,0.213,0.007,0.490,0.039,0.361,0.046,0.136,0.460,0.300,0.914,0.231
2019,3,03M479,Beacon High School,1423,3.91,3.98,0.001,0.114,0.013,0.300,0.020,0.189,0.090,0.143,0.197,0.467,0.968,0.054
2019,3,03M485,Fiorello H. LaGuardia High School of Music & Art a,2760,3.93,4.01,0.002,0.037,0.000,0.300,0.014,0.192,0.195,0.099,0.179,0.455,0.949,0.106
2019,3,03M492,"High School for Law, Advocacy and Community Justic",429,2.87,2.57,0.065,0.170,0.000,0.830,0.170,0.734,0.047,0.336,0.573,0.026,0.855,0.420
2019,3,03M494,High School of Arts and Technology,492,2.66,2.45,0.087,0.252,0.026,0.850,0.167,0.748,0.063,0.319,0.553,0.039,0.811,0.519
2019,3,03M541,Manhattan / Hunter Science High School,441,3.84,3.98,0.000,0.138,0.000,0.540,0.041,0.408,0.272,0.163,0.306,0.209,0.974,0.050
2019,3,03M859,Special Music School,181,3.62,3.51,0.006,0.144,0.006,0.360,0.050,0.182,0.094,0.105,0.155,0.475,0.931,0.222
2019,3,03M860,Frederick Douglass Academy II Secondary School,290,2.51,2.27,0.107,0.255,0.003,0.880,0.186,0.779,0.021,0.624,0.328,0.017,0.819,0.495
2019,4,04M372,Esperanza Preparatory Academy,354,2.52,2.32,0.336,0.192,0.085,0.940,0.215,0.847,0.003,0.090,0.893,0.014,0.877,0.413
2019,4,04M435,Manhattan Center for Science and Mathematics,1650,3.45,3.58,0.068,0.141,0.004,0.760,0.093,0.628,0.201,0.193,0.533,0.058,0.938,0.163
2019,4,04M495,Park East High School,389,3.03,2.97,0.041,0.180,0.000,0.780,0.093,0.645,0.067,0.254,0.617,0.026,0.943,0.128
2019,4,04M555,Central Park East High School,508,3.47,3.53,0.018,0.157,0.002,0.740,0.073,0.610,0.177,0.258,0.494,0.045,0.969,0.067
2019,4,04M610,Young Women's Leadership School,314,3.28,3.18,0.016,0.178,0.000,0.780,0.054,0.653,0.086,0.239,0.589,0.038,0.938,0.204
2019,4,04M680,"Heritage School, The",313,2.60,2.32,0.070,0.220,0.000,0.880,0.163,0.802,0.042,0.265,0.649,0.032,0.886,0.297
2019,5,05M148,Eagle Academy for Young Men of Harlem,191,2.60,2.24,0.026,0.262,0.042,0.780,0.094,0.660,0.000,0.733,0.220,0.010,0.825,0.588
2019,5,05M157,The Urban Assembly School for Global Commerce,250,2.57,2.27,0.100,0.276,0.036,0.920,0.144,0.840,0.012,0.492,0.456,0.028,0.766,0.659
