year,district,DBN,school_name,enrollment,avg_grade_8_english_proficiency,avg_grade_8_math_proficiency,%_ELL,%_disability,%_self_contained,economic_need_index,%_temp_housing,%_HRA_eligible,%_asian,%_black,%_hispanic,%_white,student_attendance_rate,%_chronically_absent
2015,10,10X351,Bronx Collaborative High School,223,2.25,2.18,0.161,0.229,0.000,0.855,0.197,0.668,0.013,0.296,0.623,0.049,0.716,0.965
2015,07,07X655,Samuel Gompers Career and Technical Education High,78,2.15,2.10,0.103,0.321,0.013,0.833,0.103,0.667,0.000,0.321,0.641,0.026,0.700,0.839
2015,05,05M469,Choir Academy of Harlem,77,2.34,2.11,0.000,0.200,0.000,0.832,0.200,0.600,0.000,0.780,0.200,0.020,0.682,0.800
2015,02,02M625,High School of Graphic Communication Arts,336,2.24,2.04,0.051,0.244,0.065,0.727,0.083,0.577,0.018,0.339,0.601,0.021,0.664,0.791
2015,08,08X650,Jane Addams High School for Academic Careers,147,2.03,2.07,0.088,0.313,0.007,0.843,0.041,0.714,0.000,0.327,0.639,0.027,0.707,0.757
2015,08,08X530,Banana Kelly High School,325,2.02,1.94,0.114,0.317,0.148,0.851,0.185,0.702,0.000,0.372,0.606,0.012,0.715,0.746
2015,08,08X452,Bronx Guild,326,2.17,1.98,0.104,0.307,0.006,0.821,0.135,0.663,0.040,0.322,0.617,0.012,0.742,0.728
2015,02,02M460,Washington Irving High School,99,2.16,2.04,0.172,0.343,0.152,0.713,0.061,0.566,0.030,0.333,0.566,0.071,0.727,0.726
2015,12,12X278,Peace and Diversity Academy,170,2.03,1.90,0.188,0.282,0.124,0.774,0.253,0.541,0.006,0.441,0.524,0.018,0.693,0.707
2015,05,05M685,Bread & Roses Integrated Arts High School,100,2.03,1.96,0.150,0.370,0.190,0.812,0.110,0.680,0.000,0.520,0.480,0.000,0.752,0.705
2015,09,09X414,Jonathan Levin High School for Media and Communica,160,2.05,1.98,0.400,0.269,0.106,0.846,0.213,0.638,0.013,0.206,0.769,0.013,0.753,0.698
2015,14,14K322,Foundations Academy,113,2.14,1.99,0.062,0.327,0.027,0.826,0.265,0.655,0.018,0.673,0.292,0.000,0.742,0.686
2015,05,05M367,Academy for Social Action: A College Board School,234,2.07,1.96,0.189,0.276,0.065,0.797,0.171,0.604,0.005,0.465,0.493,0.028,0.709,0.681
2015,08,08X295,Gateway School for Environmental Research and Tech,70,2.11,1.97,0.171,0.371,0.014,0.707,0.086,0.543,0.014,0.314,0.643,0.029,0.814,0.676
2015,10,10X660,Grace Dodge Career and Technical Education High Sc,178,2.03,1.99,0.270,0.399,0.152,0.801,0.067,0.652,0.022,0.213,0.753,0.011,0.732,0.676
2015,19,19K504,High School for Civil Rights,319,2.15,1.99,0.078,0.285,0.009,0.741,0.166,0.530,0.003,0.740,0.229,0.019,0.754,0.666
2015,02,02M520,Murry Bergtraum High School for Business Careers,971,2.33,2.18,0.107,0.203,0.067,0.711,0.122,0.536,0.089,0.461,0.407,0.030,0.729,0.650
2015,16,16K393,Frederick Douglass Academy IV Secondary School,92,2.21,1.95,0.011,0.348,0.130,0.744,0.141,0.609,0.011,0.826,0.141,0.011,0.789,0.650
2015,01,01M509,Marta Valle High School,363,2.28,2.09,0.091,0.284,0.146,0.767,0.149,0.595,0.058,0.399,0.512,0.025,0.768,0.647
2015,19,19K660,W. H. Maxwell Career and Technical Education High,506,2.10,2.00,0.059,0.300,0.176,0.818,0.132,0.680,0.010,0.696,0.281,0.006,0.734,0.644
2015,08,08X282,Women's Academy of Excellence,345,2.21,2.09,0.046,0.220,0.012,0.767,0.130,0.591,0.035,0.501,0.412,0.026,0.787,0.641
2015,13,13K265,Dr. Susan S. McKinney Secondary School of the Arts,421,2.31,2.07,0.033,0.205,0.003,0.782,0.091,0.609,0.007,0.730,0.228,0.007,0.792,0.640
2015,03,03M494,High School of Arts and Technology,594,2.25,2.17,0.106,0.221,0.047,0.775,0.155,0.598,0.039,0.325,0.593,0.029,0.767,0.639
2015,09,09X404,School for Excellence,421,2.12,2.07,0.271,0.278,0.050,0.875,0.233,0.724,0.007,0.266,0.708,0.010,0.753,0.639
2015,09,09X517,Frederick Douglass Academy III Secondary School,427,2.13,2.03,0.117,0.218,0.089,0.836,0.204,0.656,0.007,0.504,0.454,0.023,0.798,0.638
2015,09,09X276,Leadership Institute,207,2.02,1.95,0.213,0.300,0.048,0.902,0.164,0.758,0.000,0.343,0.633,0.019,0.749,0.631
2015,05,05M369,Urban Assembly School for the Performing Arts,358,2.22,2.11,0.047,0.207,0.011,0.775,0.126,0.634,0.008,0.522,0.430,0.014,0.810,0.628
2015,12,12X479,Bronx Career and College Preparatory High School,333,2.16,2.05,0.153,0.291,0.036,0.854,0.213,0.688,0.009,0.405,0.568,0.006,0.793,0.628
2015,12,12X521,The Metropolitan Soundview High School,416,2.16,2.16,0.130,0.226,0.026,0.807,0.132,0.649,0.026,0.262,0.673,0.017,0.788,0.625
2015,19,19K639,Brooklyn Lab School,334,2.18,2.04,0.177,0.234,0.009,0.807,0.135,0.665,0.054,0.356,0.569,0.009,0.736,0.616
2015,10,10X546,Bronx Theatre High School,428,2.23,2.06,0.100,0.238,0.028,0.788,0.147,0.607,0.005,0.301,0.671,0.016,0.809,0.616
2015,07,07X427,Community School for Social Justice,324,2.15,2.09,0.099,0.250,0.015,0.841,0.151,0.685,0.015,0.296,0.673,0.012,0.794,0.614
2015,12,12X692,Monroe Academy for Visual Arts & Design,445,2.05,2.01,0.243,0.256,0.090,0.847,0.139,0.688,0.011,0.180,0.784,0.009,0.771,0.609
2015,07,07X520,Foreign Language Academy of Global Studies,145,2.06,1.94,0.214,0.317,0.159,0.860,0.152,0.697,0.028,0.269,0.676,0.014,0.794,0.609
2015,09,09X543,High School for Violin and Dance,384,2.15,2.07,0.117,0.260,0.005,0.858,0.219,0.703,0.005,0.341,0.646,0.003,0.792,0.609
2015,08,08X561,Bronx Compass High School,332,2.26,2.10,0.081,0.283,0.009,0.788,0.163,0.617,0.024,0.346,0.602,0.009,0.802,0.606
2015,11,11X544,High School for Contemporary Arts,493,2.23,2.07,0.077,0.290,0.101,0.788,0.118,0.641,0.008,0.381,0.592,0.010,0.788,0.604
2015,16,16K455,Boys and Girls High School,648,2.14,2.02,0.049,0.259,0.127,0.763,0.165,0.582,0.009,0.872,0.086,0.017,0.784,0.603
2015,27,27Q324,Rockaway Park High School for Environmental Sustai,368,2.27,2.06,0.052,0.198,0.014,0.682,0.084,0.541,0.035,0.467,0.302,0.147,0.782,0.601
2015,27,27Q400,August Martin High School,679,2.19,2.03,0.068,0.214,0.010,0.581,0.113,0.433,0.075,0.754,0.130,0.015,0.789,0.593
2015,12,12X682,Fannie Lou Hamer Freedom High School,470,2.12,2.05,0.081,0.294,0.113,0.853,0.134,0.721,0.004,0.285,0.704,0.002,0.817,0.593
2015,12,12X271,East Bronx Academy for the Future,618,2.21,2.04,0.109,0.306,0.093,0.853,0.169,0.689,0.030,0.254,0.710,0.005,0.813,0.592
2015,04,04M409,Coalition School for Social Change,283,2.12,2.03,0.099,0.343,0.025,0.822,0.124,0.678,0.042,0.410,0.502,0.035,0.795,0.591
2015,32,32K556,Bushwick Leaders High School for Academic Excellen,317,2.08,2.00,0.196,0.240,0.006,0.822,0.177,0.669,0.009,0.167,0.814,0.003,0.824,0.590
2015,03,03M860,Frederick Douglass Academy II Secondary School,411,2.14,2.02,0.080,0.217,0.000,0.786,0.130,0.601,0.022,0.678,0.263,0.019,0.796,0.589
2015,16,16K594,Gotham Professional Arts Academy,226,2.30,2.11,0.018,0.235,0.009,0.768,0.199,0.580,0.009,0.819,0.146,0.013,0.777,0.585
2015,23,23K493,Brooklyn Collegiate: A College Board School,353,2.23,2.07,0.025,0.238,0.071,0.698,0.108,0.501,0.014,0.875,0.096,0.003,0.791,0.583
2015,02,02M425,Leadership and Public Service High School,699,2.33,2.18,0.067,0.203,0.043,0.751,0.089,0.597,0.039,0.279,0.619,0.044,0.792,0.583
2015,14,14K610,Automotive High School,383,2.14,2.10,0.070,0.292,0.094,0.706,0.076,0.569,0.016,0.559,0.381,0.029,0.805,0.578
2015,09,09X227,Bronx Collegiate Academy,382,2.09,2.01,0.272,0.230,0.081,0.833,0.168,0.673,0.010,0.285,0.691,0.003,0.801,0.576
2015,07,07X473,Mott Haven Village Preparatory High School,364,2.15,2.08,0.096,0.217,0.003,0.824,0.113,0.665,0.003,0.253,0.736,0.005,0.799,0.574
2015,07,07X670,Health Opportunities High School,554,2.18,2.12,0.078,0.193,0.081,0.834,0.117,0.688,0.031,0.361,0.579,0.018,0.790,0.571
2015,08,08X519,Felisa Rincon de Gautier Institute for Law and Pub,307,2.13,1.98,0.101,0.274,0.062,0.821,0.205,0.651,0.020,0.254,0.678,0.029,0.793,0.569
2015,15,15K463,Secondary School for Journalism,285,2.33,2.14,0.126,0.207,0.000,0.694,0.091,0.544,0.074,0.467,0.375,0.063,0.802,0.569
2015,07,07X522,Bronx Design and Construction Academy,563,2.20,2.19,0.142,0.252,0.039,0.824,0.096,0.680,0.014,0.240,0.705,0.034,0.814,0.569
2015,01,01M292,Henry Street School for International Studies,255,2.18,2.06,0.127,0.298,0.015,0.832,0.190,0.663,0.132,0.244,0.566,0.039,0.766,0.568
2015,09,09X297,Morris Academy for Collaborative Studies,471,2.14,2.00,0.187,0.253,0.051,0.850,0.149,0.686,0.008,0.263,0.720,0.004,0.796,0.565
2015,14,14K477,School for Legal Studies,598,2.26,2.11,0.166,0.189,0.017,0.787,0.196,0.602,0.010,0.458,0.500,0.013,0.779,0.565
2015,14,14K586,Lyons Community School,520,2.20,2.03,0.128,0.214,0.003,0.843,0.157,0.662,0.018,0.398,0.558,0.024,0.799,0.565
2015,16,16K688,The Brooklyn Academy of Global Finance,152,2.11,2.03,0.112,0.303,0.059,0.795,0.184,0.612,0.059,0.717,0.204,0.020,0.805,0.560
2015,13,13K350,Urban Assembly High School of Music and Art,387,2.30,2.11,0.026,0.240,0.052,0.751,0.098,0.605,0.005,0.775,0.207,0.005,0.816,0.557
2015,12,12X251,Explorations Academy,358,2.13,2.07,0.182,0.235,0.003,0.814,0.151,0.651,0.008,0.271,0.698,0.020,0.824,0.557
2015,12,12X248,"Metropolitan High School, The",326,2.11,2.09,0.218,0.276,0.049,0.828,0.120,0.678,0.009,0.215,0.748,0.003,0.827,0.557
2015,19,19K507,Performing Arts and Technology High School,406,2.24,2.09,0.025,0.207,0.032,0.763,0.113,0.621,0.002,0.808,0.182,0.005,0.812,0.556
2015,19,19K659,Cypress Hills Collegiate Preparatory School,330,2.21,2.04,0.209,0.188,0.009,0.772,0.106,0.633,0.045,0.197,0.712,0.033,0.783,0.551
2015,03,03M307,"Urban Assembly School for Media Studies, The",412,2.25,2.13,0.095,0.206,0.002,0.723,0.083,0.573,0.019,0.364,0.578,0.017,0.841,0.551
2015,02,02M429,Legacy School for Integrated Studies,19,2.19,2.03,0.000,0.474,0.000,0.729,0.000,0.632,0.000,0.368,0.632,0.000,0.828,0.550
2015,02,02M529,Jacqueline Kennedy Onassis High School,676,2.29,2.16,0.059,0.186,0.024,0.771,0.093,0.620,0.040,0.213,0.701,0.036,0.802,0.550
2015,13,13K499,ACORN Community High School,504,2.23,2.08,0.034,0.272,0.040,0.751,0.165,0.562,0.010,0.835,0.129,0.016,0.792,0.549
2015,22,22K495,Sheepshead Bay High School,562,2.23,2.15,0.240,0.169,0.101,0.629,0.093,0.473,0.148,0.523,0.192,0.133,0.774,0.548
2015,12,12X684,Wings Academy,501,2.18,2.10,0.034,0.242,0.022,0.813,0.124,0.661,0.008,0.585,0.379,0.012,0.819,0.546
2015,84,84M433,Renaissance Charter High School for Innovation,444,2.13,1.99,0.088,0.347,0.045,0.825,0.101,0.682,0.014,0.387,0.579,0.009,0.826,0.546
2015,02,02M316,"Urban Assembly School of Business for Young Women,",405,2.30,2.19,0.044,0.185,0.002,0.736,0.101,0.578,0.035,0.528,0.393,0.022,0.799,0.545
2015,10,10X284,Bronx School of Law and Finance,426,2.24,2.13,0.089,0.246,0.063,0.819,0.129,0.660,0.021,0.303,0.648,0.026,0.820,0.544
2015,17,17K533,School for Democracy and  Leadership,319,2.25,2.14,0.054,0.236,0.019,0.653,0.140,0.434,0.008,0.876,0.074,0.023,0.799,0.543
2015,08,08X432,BRONX BRIDGES HIGH SCHOOL,333,1.80,1.98,0.823,0.117,0.006,0.834,0.270,0.631,0.078,0.066,0.829,0.018,0.832,0.540
2015,32,32K552,Academy of Urban Planning,279,2.04,1.94,0.290,0.287,0.043,0.808,0.154,0.649,0.007,0.233,0.738,0.007,0.821,0.539
2015,19,19K618,Academy of Innovative Technology,413,2.24,2.10,0.099,0.242,0.024,0.689,0.085,0.516,0.053,0.455,0.455,0.012,0.823,0.539
2015,32,32K403,Academy for Environmental Leadership,340,2.07,2.01,0.324,0.256,0.076,0.786,0.126,0.626,0.018,0.194,0.771,0.015,0.815,0.539
2015,21,21K348,High School of Sports Management,290,2.20,2.12,0.041,0.190,0.003,0.703,0.103,0.552,0.038,0.724,0.169,0.055,0.809,0.537
2015,02,02M419,Landmark High School,355,2.23,2.07,0.104,0.245,0.006,0.804,0.099,0.687,0.037,0.242,0.685,0.017,0.819,0.534
2015,18,18K589,Arts & Media Preparatory Academy,279,2.29,2.06,0.039,0.194,0.007,0.751,0.125,0.591,0.011,0.828,0.125,0.014,0.843,0.531
2015,02,02M655,Life Sciences Secondary School,697,2.38,2.28,0.070,0.180,0.053,0.765,0.106,0.604,0.043,0.283,0.622,0.032,0.825,0.529
2015,23,23K514,Frederick Douglass Academy VII High School,319,2.24,2.07,0.022,0.276,0.025,0.710,0.154,0.533,0.000,0.881,0.113,0.003,0.781,0.528
2015,19,19K510,World Academy for Total Community Health High Scho,284,2.20,2.08,0.113,0.236,0.011,0.710,0.113,0.539,0.025,0.757,0.190,0.014,0.812,0.524
2015,07,07X600,Alfred E. Smith Career and Technical Education Hig,375,2.08,2.03,0.192,0.283,0.069,0.798,0.147,0.640,0.011,0.291,0.683,0.008,0.830,0.523
2015,09,09X329,DreamYard Preparatory School,336,2.17,2.04,0.214,0.196,0.030,0.859,0.244,0.682,0.015,0.336,0.607,0.012,0.792,0.523
2015,04,04M680,"Heritage School, The",322,2.20,2.06,0.059,0.292,0.000,0.806,0.140,0.652,0.012,0.323,0.637,0.019,0.827,0.522
2015,08,08X405,Herbert H. Lehman High School,1535,2.25,2.13,0.103,0.253,0.116,0.707,0.078,0.545,0.092,0.236,0.549,0.106,0.794,0.521
2015,08,08X376,Antonia Pantoja Preparatory Academy: A College Boa,450,2.20,2.05,0.143,0.253,0.013,0.756,0.160,0.540,0.063,0.262,0.654,0.013,0.809,0.521
2015,16,16K765,Nelson Mandela High School,124,2.19,2.16,0.016,0.210,0.048,0.811,0.121,0.653,0.000,0.863,0.105,0.024,0.855,0.520
2015,28,28Q328,High School for Community Leadership,418,2.31,2.22,0.156,0.151,0.005,0.563,0.084,0.409,0.227,0.423,0.266,0.045,0.830,0.520
2015,09,09X412,Bronx High School of Business,339,2.07,2.01,0.298,0.263,0.091,0.825,0.186,0.596,0.015,0.333,0.631,0.012,0.789,0.517
2015,10,10X439,Bronx High School for Law and Community Service,398,2.16,2.06,0.151,0.271,0.028,0.863,0.186,0.724,0.013,0.244,0.709,0.018,0.834,0.515
2015,18,18K642,Urban Action Academy,309,2.22,2.09,0.107,0.201,0.039,0.601,0.091,0.434,0.029,0.790,0.123,0.042,0.836,0.515
2015,19,19K502,FDNY High School for Fire and Life Safety,324,2.14,2.03,0.046,0.259,0.031,0.772,0.117,0.630,0.012,0.716,0.244,0.019,0.806,0.511
2015,04,04M372,ESPERANZA PREPARATORY ACADEMY,507,2.15,2.15,0.418,0.219,0.089,0.836,0.253,0.646,0.013,0.131,0.831,0.021,0.853,0.510
2015,12,12X511,Bronx Envision Academy,355,2.22,2.14,0.130,0.211,0.008,0.815,0.169,0.634,0.020,0.344,0.603,0.020,0.820,0.507
2015,07,07X259,"H.E.R.O. High (Health, Education, and Research Occ",231,2.25,2.13,0.113,0.177,0.009,0.817,0.126,0.654,0.022,0.355,0.589,0.017,0.843,0.506
2015,03,03M415,Wadleigh Secondary School for the Performing & Vis,445,2.28,2.08,0.048,0.221,0.098,0.791,0.151,0.631,0.018,0.520,0.442,0.010,0.782,0.506
2015,02,02M437,Hudson High School of Learning Technologies,483,2.28,2.23,0.087,0.222,0.004,0.754,0.143,0.594,0.064,0.292,0.594,0.033,0.826,0.506
2015,06,06M346,Community Health Academy of the Heights,629,2.22,2.10,0.219,0.208,0.016,0.850,0.145,0.688,0.000,0.049,0.918,0.027,0.812,0.506
2015,30,30Q450,Long Island City High School,2123,2.36,2.33,0.119,0.176,0.016,0.627,0.052,0.491,0.157,0.135,0.602,0.090,0.802,0.505
2015,10,10X438,Fordham Leadership Academy for Business and Techno,438,2.11,2.03,0.167,0.288,0.116,0.855,0.174,0.699,0.018,0.276,0.678,0.027,0.834,0.505
2015,18,18K637,Academy for Conservation and the Environment,308,2.23,2.10,0.071,0.231,0.016,0.647,0.143,0.497,0.016,0.860,0.097,0.013,0.846,0.503
2015,02,02M300,"Urban Assembly School of Design and Construction,",414,2.24,2.24,0.063,0.208,0.017,0.726,0.114,0.563,0.060,0.295,0.592,0.034,0.830,0.502
2015,10,10X213,Bronx Engineering and Technology Academy,417,2.22,2.23,0.098,0.209,0.005,0.753,0.106,0.595,0.067,0.343,0.559,0.014,0.835,0.502
2015,11,11X253,Bronx High School for Writing and Communication Ar,389,2.27,2.02,0.075,0.239,0.026,0.751,0.136,0.596,0.033,0.450,0.491,0.013,0.834,0.502
2015,28,28Q157,J.H.S. 157 Stephen A. Halsey,1529,2.14,2.14,0.219,0.411,0.329,0.408,0.082,0.411,0.096,0.288,0.288,0.315,0.869,0.500
2015,03,03M402,The Urban Assembly School for Green Careers,353,2.22,2.13,0.161,0.263,0.011,0.793,0.122,0.649,0.011,0.232,0.720,0.028,0.842,0.500
2015,13,13K412,"Brooklyn Community High School of Communication, A",404,2.26,2.07,0.050,0.205,0.000,0.767,0.109,0.601,0.012,0.785,0.178,0.007,0.841,0.499
2015,32,32K549,Bushwick School for Social Justice,405,2.16,2.03,0.215,0.195,0.007,0.768,0.131,0.593,0.005,0.205,0.760,0.025,0.799,0.498
2015,19,19K583,Multicultural High School,229,1.76,1.95,0.900,0.022,0.004,0.728,0.127,0.498,0.000,0.000,0.996,0.004,0.848,0.498
2015,08,08X293,Renaissance High School for Musical Theater & Tech,444,2.28,2.09,0.036,0.241,0.005,0.730,0.077,0.597,0.032,0.279,0.610,0.072,0.831,0.496
2015,02,02M303,"Facing History School, The",406,2.17,2.09,0.195,0.251,0.002,0.811,0.131,0.665,0.017,0.273,0.675,0.022,0.830,0.492
2015,09,09X525,Bronx Leadership Academy High School,686,2.16,2.07,0.098,0.246,0.111,0.827,0.090,0.688,0.004,0.357,0.617,0.006,0.817,0.492
2015,14,14K685,El Puente Academy for Peace and Justice,245,2.23,2.10,0.155,0.245,0.000,0.780,0.069,0.612,0.000,0.118,0.853,0.012,0.852,0.492
2015,27,27Q351,Rockaway Collegiate High School,397,2.28,2.06,0.055,0.214,0.010,0.688,0.078,0.526,0.050,0.526,0.335,0.038,0.808,0.491
2015,06,06M463,High School for Media and Communications,479,2.18,2.09,0.338,0.198,0.035,0.832,0.190,0.672,0.019,0.138,0.825,0.013,0.826,0.490
2015,14,14K454,Green School: An Academy for Environmental Careers,276,2.19,2.03,0.254,0.221,0.011,0.775,0.185,0.583,0.007,0.380,0.591,0.014,0.837,0.490
2015,07,07X548,Urban Assembly School for Careers in Sports,587,2.39,2.31,0.072,0.233,0.005,0.820,0.116,0.675,0.002,0.286,0.695,0.014,0.801,0.489
2015,17,17K751,Academy for Health Careers,373,2.39,2.24,0.027,0.139,0.032,0.706,0.131,0.542,0.016,0.855,0.088,0.008,0.844,0.489
2015,08,08X559,School for Tourism and Hospitality,240,2.13,2.06,0.154,0.171,0.025,0.847,0.158,0.675,0.013,0.354,0.604,0.000,0.831,0.489
2015,10,10X433,High School for Teaching and the Professions,486,2.18,2.09,0.212,0.247,0.012,0.807,0.121,0.617,0.019,0.204,0.745,0.027,0.822,0.487
2015,14,14K071,Juan Morel Campos Secondary School,692,2.04,2.00,0.231,0.279,0.030,0.868,0.141,0.688,0.003,0.136,0.827,0.025,0.861,0.484
2015,07,07X551,The Urban Assembly Bronx Academy of Letters,591,2.15,2.02,0.136,0.250,0.111,0.882,0.075,0.711,0.009,0.304,0.669,0.015,0.828,0.484
2015,10,10X374,Knowledge and Power Preparatory Academy Internatio,487,2.31,2.23,0.150,0.224,0.035,0.766,0.113,0.571,0.025,0.322,0.614,0.021,0.851,0.484
2015,03,03M283,Manhattan Theatre Lab High School,53,2.23,2.15,0.151,0.340,0.000,0.787,0.132,0.604,0.019,0.377,0.566,0.038,0.825,0.482
2015,03,03M299,"High School for Arts, Imagination and Inquiry",447,2.25,2.12,0.128,0.226,0.040,0.754,0.141,0.586,0.004,0.385,0.588,0.009,0.830,0.482
2015,07,07X547,New Explorers High School,475,2.11,2.01,0.103,0.261,0.118,0.855,0.145,0.705,0.004,0.314,0.676,0.004,0.809,0.479
2015,19,19K683,"The School for Classics: An Academy of Thinkers, W",308,2.34,2.09,0.136,0.218,0.130,0.764,0.094,0.607,0.078,0.607,0.260,0.042,0.839,0.475
2015,02,02M393,BUSINESS OF SPORTS SCHOOL,449,2.22,2.16,0.073,0.223,0.000,0.714,0.114,0.546,0.022,0.354,0.595,0.016,0.847,0.475
2015,14,14K474,PROGRESS High School for Professional Careers,1098,2.21,2.11,0.143,0.183,0.026,0.766,0.083,0.618,0.010,0.351,0.626,0.008,0.827,0.471
2015,24,24Q485,Grover Cleveland High School,1828,2.35,2.28,0.212,0.168,0.050,0.612,0.080,0.443,0.097,0.045,0.657,0.189,0.822,0.470
2015,15,15K448,Brooklyn Secondary School for Collaborative Studie,685,2.44,2.18,0.033,0.275,0.000,0.635,0.073,0.443,0.058,0.385,0.453,0.093,0.846,0.470
2015,27,27Q480,John Adams High School,2634,2.28,2.18,0.194,0.156,0.047,0.591,0.129,0.422,0.310,0.239,0.379,0.029,0.825,0.469
2015,07,07X527,Bronx Leadership Academy II High School,495,2.13,2.12,0.139,0.267,0.034,0.831,0.109,0.689,0.022,0.323,0.634,0.008,0.854,0.463
2015,12,12X372,Urban Assembly School for Wildlife Conservation,571,2.32,2.18,0.067,0.217,0.006,0.809,0.128,0.606,0.022,0.253,0.694,0.022,0.837,0.462
2015,11,11X270,Academy for Scholarship and Entrepreneurship: A Co,371,2.18,2.03,0.054,0.240,0.032,0.661,0.084,0.499,0.032,0.636,0.305,0.011,0.849,0.461
2015,21,21K410,Abraham Lincoln High School,2341,2.41,2.30,0.134,0.154,0.065,0.658,0.064,0.504,0.151,0.398,0.237,0.201,0.828,0.461
2015,27,27Q260,Frederick Douglass Academy VI High School,409,2.22,2.04,0.086,0.213,0.042,0.705,0.086,0.570,0.015,0.597,0.379,0.007,0.825,0.460
2015,27,27Q309,Academy of Medical Technology: A College Board Sch,637,2.32,2.12,0.085,0.168,0.005,0.667,0.054,0.484,0.066,0.501,0.377,0.027,0.837,0.460
2015,10,10X440,DeWitt Clinton High School,2109,2.32,2.22,0.217,0.186,0.093,0.749,0.145,0.549,0.086,0.316,0.545,0.036,0.812,0.458
2015,25,25Q460,Flushing High School,2186,2.34,2.27,0.207,0.139,0.037,0.554,0.059,0.403,0.203,0.237,0.511,0.037,0.830,0.458
2015,11,11X508,Bronxdale High School,427,2.30,2.16,0.026,0.187,0.012,0.690,0.103,0.532,0.030,0.288,0.571,0.094,0.847,0.453
2015,08,08X269,Bronx Studio School for Writers and Artists,565,2.29,2.24,0.120,0.240,0.055,0.853,0.111,0.729,0.012,0.203,0.769,0.006,0.864,0.452
2015,02,02M047,47 The American Sign Language and English Secondar,169,2.40,2.24,0.047,0.254,0.083,0.733,0.107,0.592,0.012,0.284,0.645,0.053,0.881,0.451
2015,08,08X332,Holcombe L. Rucker School of Community Research,236,2.06,1.99,0.110,0.297,0.081,0.836,0.186,0.661,0.004,0.432,0.547,0.004,0.850,0.450
2015,15,15K519,Cobble Hill School of American Studies,596,2.31,2.15,0.091,0.213,0.079,0.693,0.092,0.534,0.045,0.638,0.250,0.044,0.828,0.450
2015,02,02M305,"Urban Assembly Academy of Government and Law, The",329,2.35,2.22,0.033,0.188,0.003,0.749,0.146,0.608,0.058,0.419,0.492,0.027,0.859,0.448
2015,12,12X550,High School of World Cultures,410,1.91,1.94,0.846,0.000,0.000,0.766,0.300,0.439,0.080,0.083,0.802,0.012,0.848,0.448
2015,27,27Q302,"Queens High School for Information, Research, and",381,2.23,2.02,0.186,0.178,0.013,0.611,0.068,0.451,0.042,0.491,0.436,0.021,0.860,0.447
2015,08,08X305,Pablo Neruda Academy,315,2.05,1.96,0.184,0.356,0.022,0.803,0.156,0.619,0.044,0.260,0.676,0.013,0.842,0.447
2015,06,06M462,The College Academy,491,2.05,2.05,0.444,0.210,0.043,0.838,0.169,0.690,0.002,0.090,0.892,0.006,0.852,0.445
2015,06,06M468,High School for Health Careers and Sciences,605,2.20,2.12,0.307,0.182,0.002,0.838,0.205,0.653,0.013,0.159,0.798,0.015,0.857,0.445
2015,09,09X324,Bronx Early College Academy for Teaching & Learnin,503,2.41,2.23,0.068,0.151,0.007,0.819,0.082,0.599,0.036,0.287,0.674,0.004,0.858,0.444
2015,02,02M427,MANHATTAN ACADEMY FOR ARTS & LANGUAGE,334,1.83,2.07,0.784,0.033,0.003,0.750,0.263,0.449,0.024,0.048,0.913,0.015,0.851,0.442
2015,08,08X349,Bronx River High School,204,2.18,2.06,0.147,0.240,0.010,0.758,0.157,0.603,0.029,0.299,0.608,0.025,0.875,0.441
2015,23,23K697,Teachers Preparatory High School,390,2.28,2.11,0.031,0.226,0.113,0.712,0.088,0.535,0.003,0.830,0.157,0.006,0.815,0.439
2015,06,06M348,Washington Heights Expeditionary Learning School,705,2.36,2.51,0.147,0.232,0.003,0.840,0.131,0.689,0.003,0.038,0.948,0.005,0.855,0.436
2015,08,08X312,Millennium Art Academy,487,2.26,2.11,0.047,0.294,0.006,0.785,0.092,0.641,0.023,0.300,0.651,0.018,0.855,0.436
2015,21,21K344,Rachel Carson High School for Coastal Studies,560,2.49,2.37,0.105,0.189,0.002,0.601,0.039,0.482,0.102,0.225,0.223,0.436,0.861,0.436
2015,02,02M392,MANHATTAN BUSINESS ACADEMY,438,2.34,2.26,0.055,0.183,0.005,0.715,0.075,0.553,0.034,0.281,0.621,0.039,0.856,0.436
2015,18,18K629,Cultural Academy for the Arts and Sciences,353,2.21,2.10,0.059,0.221,0.006,0.586,0.088,0.425,0.006,0.904,0.085,0.006,0.836,0.435
2015,09,09X263,Validus Preparatory Academy: An Expeditionary Lear,375,2.17,2.17,0.115,0.224,0.075,0.837,0.101,0.667,0.016,0.269,0.707,0.008,0.843,0.435
2015,21,21K572,Expeditionary Learning School for Community Leader,271,2.39,2.36,0.173,0.166,0.004,0.635,0.100,0.472,0.155,0.173,0.421,0.232,0.877,0.435
2015,03,03M492,"High School for Law, Advocacy and Community Justic",510,2.43,2.28,0.059,0.163,0.045,0.754,0.122,0.596,0.024,0.420,0.527,0.022,0.845,0.431
2015,02,02M449,Vanguard High School,486,2.35,2.21,0.078,0.218,0.012,0.685,0.068,0.527,0.076,0.274,0.570,0.047,0.872,0.429
2015,07,07X334,International Community High School,463,1.73,1.91,0.860,0.032,0.004,0.790,0.248,0.497,0.065,0.140,0.767,0.013,0.834,0.429
2015,26,26Q435,Martin Van Buren High School,1742,2.31,2.15,0.109,0.118,0.052,0.491,0.059,0.363,0.270,0.527,0.130,0.036,0.844,0.428
2015,18,18K567,Brooklyn Theatre Arts High School,395,2.29,2.06,0.038,0.182,0.013,0.725,0.116,0.597,0.005,0.820,0.132,0.018,0.847,0.428
2015,02,02M296,High School of Hospitality Management,424,2.31,2.25,0.078,0.175,0.028,0.751,0.090,0.585,0.050,0.210,0.712,0.017,0.848,0.428
2015,02,02M580,Richard R. Green High School of Teaching,566,2.30,2.17,0.051,0.242,0.034,0.764,0.117,0.622,0.062,0.311,0.588,0.027,0.853,0.427
2015,29,29Q326,Cambria Heights Academy,372,2.33,2.13,0.035,0.204,0.000,0.442,0.051,0.333,0.067,0.790,0.091,0.022,0.868,0.426
2015,08,08X558,Westchester Square Academy,396,2.37,2.19,0.068,0.225,0.013,0.701,0.093,0.553,0.045,0.268,0.566,0.088,0.865,0.423
2015,02,02M374,Gramercy Arts High School,530,2.49,2.25,0.021,0.175,0.006,0.662,0.083,0.479,0.036,0.425,0.442,0.058,0.865,0.420
2015,15,15K429,Brooklyn School for Global Studies,250,2.27,2.13,0.078,0.259,0.000,0.749,0.054,0.584,0.024,0.548,0.355,0.066,0.845,0.419
2015,27,27Q475,Richmond Hill High School,2175,2.29,2.18,0.213,0.160,0.062,0.596,0.061,0.455,0.314,0.136,0.482,0.054,0.853,0.419
2015,32,32K545,EBC High School for Public Service - Bushwick,514,2.13,2.10,0.200,0.200,0.002,0.807,0.078,0.687,0.004,0.080,0.907,0.002,0.847,0.418
2015,02,02M543,New Design High School,441,2.34,2.16,0.054,0.265,0.048,0.745,0.145,0.576,0.059,0.308,0.569,0.039,0.848,0.417
2015,17,17K408,Academy of Hospitality and Tourism,285,2.14,1.98,0.158,0.232,0.018,0.649,0.147,0.481,0.035,0.846,0.102,0.011,0.825,0.417
2015,11,11X545,Bronx Aerospace High School,431,2.22,2.15,0.116,0.318,0.058,0.752,0.118,0.575,0.023,0.292,0.645,0.021,0.807,0.416
2015,25,25Q425,John Bowne High School,3667,2.41,2.39,0.202,0.130,0.055,0.573,0.052,0.433,0.294,0.184,0.460,0.045,0.824,0.416
2015,27,27Q314,Epic High School - South,87,2.45,2.21,0.034,0.080,0.011,0.554,0.092,0.414,0.264,0.322,0.264,0.069,0.884,0.415
2015,17,17K382,Academy for College Preparation and Career Explora,505,2.22,2.09,0.064,0.196,0.008,0.684,0.090,0.524,0.017,0.846,0.123,0.008,0.826,0.414
2015,09,09X252,Mott Hall Bronx High School,402,2.26,2.28,0.109,0.234,0.104,0.840,0.090,0.692,0.012,0.201,0.756,0.012,0.859,0.413
